인덱스,검색어,날짜,신문사,제목,내용
8,유한양행,2020.05.20,donga.com,"유한양행, ‘산학융합 뇌질환 R&BD; 생태계 구축’ 3자 업무협약","유한양행-성균관대-아임뉴런 3자 협약제약사·대학·벤처 협력하는 첫 사례글로벌 수준 뇌질환 기반기술 생태계 구축유한양행은 성균관대학교, 아임뉴런바이오사이언스와 ‘신학융합 뇌질환 R&DB 생태계 구축 협력사업’을 위한 3자 업무협약을 체결했다고 20일 밝혔다. 이번 협약은 국가 바이오산업 발전과 인류 건강 증진을 목표로 한다는 설명이다.협약을 통해 ▲바이오 분야 교육･연구 클러스터 구축 ▲미래 유망 기술개발 및 중추신경계(CNS) 파이프라인 창출 ▲삼성서울병원과 공동연구 및 신약개발 협력 ▲뇌질환 산학융합연구소 설립 등을 추진한다. 글로벌 수준 지속 가능한 산학융합 뇌질환 R&BD 생태계를 구축하고 세계 선도기관으로 도약한다는 복안이다.이번 협약은 국내에서 처음으로 제약회사와 대학, 바이오벤처 등이 화학적 결합을 이뤄낸 사례다. 이를 통해 새로운 형태의 산학융합 뇌질환 R&BD 생태계를 구축하게 됐다는 점에서 의미있다고 유한양행 측은 강조했다. 특히 성균관대와 삼성서울병원, 뇌질환 산학융합연구소가 유기적으로 협력해 연구인력을 양성하고 인적교류를 활성화할 전망이다. 세 기관은 기초연구부터 신약개발 전반에 걸쳐 필요한 연구 인프라와 기반기술, 중개연구, 임상, 사업화 등의 역량을 집약해 세계를 선도하는 연구와 혁신신약 개발에 성공할 수 있을 것으로 기대하고 있다.유한향행의 경우 뇌질환 분야에서 미래 유망 기반기술을 육성한다는 방침이다. 여기에 투자 및 공동개발을 통해 사업성이 유망한 CNS 파이프라인을 확보한다는 계획이다. 이는 유한양행이 전략적으로 확대하고 있는 뇌질환 분야에서 한발 앞서가는 행보라는 평가다.성균관대는 이번 협약을 통해 공동으로 설립할 ‘뇌질환 산학융합연구소’ 내 신규학과를 신설하고 산학연계 학위트랙을 통해 신약개발 분야 창의리더를 양성한다는 목표다. 협약 파트너들과 세계적 수준 CNS 연구역량 및 인프라를 공유할 것으로 기대한다는 입장이다. 아임뉴런은 뇌질환 및 유전자질환 신약개발을 위한 미래 유망 기반기술을 개발하고 신규 CNS 파이프라인 창출을 추진한다.이정희 유한양행 사장은 “이번 협약은 국내 최초로 제약회사와 대학, 바이오벤처 등 세 기관이 화학적 결합을 통해 차별화된 뇌질환 R&BD 생태계를 조성하는 것”이라며 “이를 통해 혁신 신약개발을 위한 새로운 성장 동력을 확보하고 글로벌 제약사 도약과 국가 바이오산업 발전에 기여할 것으로 기대한다”고 말했다.한편 유한양행과 성균관대는 지난해 6월 뇌질환 공동연구개발, 핵심인재 양성, 유망 벤처기업 발굴 및 육성 등을 주요 내용으로 하는 포괄적·전략적 산학협력관계를 구축하는 업무협약을 체결한 바 있다. 해당 협약의 사업내용 일환으로 올해부터 차세대 핵심인재 양성을 위한 ‘유한(YUHAN) 신약개발 트랙’ 프로그램을 가동했다. 현재 유한양행과 아임뉴런은 3개의 뇌암·뇌질환 신약 프로그램을 공동으로 연구·개발하고 있다.동아닷컴 김민범 기자 mbkim@donga.com▶ 네이버에서 [동아일보] 채널 구독하기▶ 집 볼 때 쓰는 메모장 '집보장'ⓒ 동아일보 & donga.com, 무단 전재 및 재배포 금지"
9,유한양행,2020.05.20,디지털타임스,"유한양행, 성균관대·아임뉴런과 산학융합 뇌질환 R&BD; 생태계 구축","유한양행은 성균관대학교, 아임뉴런바이오사이언스와 3자 업무협약을 체결했다고 20일 밝혔다. 이번 협약은 차별화된 산학융합 뇌질환 R&BD; 생태계 구축 협력사업을 통해 국가 바이오산업 발전과 인류 건강 증진을 목표로 하고 있다.유한양행, 성균관대, 아임뉴런은 이번 협약을 통해 △바이오 분야 교육·연구 클러스터 구축 △미래 유망 기술개발 및 CNS 파이프라인 창출 △삼성서울병원과 공동연구 및 신약개발 협력 △'뇌질환 산학융합연구소' 설립 등 세계적인 수준의 지속 가능한 산학융합 뇌질환 R&BD; 생태계를 구축하고 글로벌 선도기관으로 도약한다는 계획이다. 이번 협약을 통해 성균관대, 삼성서울병원, 뇌질환 산학융합연구소는 유기적 관계 속에서 연구인력 양성 및 인적교류를 활성화하고, 긴밀한 정보 공유체계를 구축하기로 했다.세 기관은 기초연구부터 신약개발 전반에 걸쳐 필요한 연구 인프라, 기반기술, 중개연구, 임상, 사업화 등의 역량을 총 결집함으로써 세계를 선도하는 연구와 혁신신약 개발에 성공할 수 있을 것으로 기대하고 있다.이번 협약을 통해 유한양행은 뇌질환 분야에서 미래유망한 기반기술을 육성하고, 투자 및 공동개발을 통해 사업성이 유망한 CNS(central nervous system;중추 신경계) 파이프라인을 확보할 계획이다.또한 성균관대는 공동으로 설립할 '뇌질환 산학융합연구소' 내 신규학과를 신설하고, 산학연계 학위트랙을 통해 신약개발 분야의 창의리더를 양성한다. 이로써 협약 파트너들과 세계적 수준의 CNS 연구역량 및 인프라를 공유할 것으로 기대된다.아임뉴런은 뇌질환 및 유전자질환 신약개발을 위한 미래 유망 기반기술을 개발하고, 신규 CNS 파이프라인을 창출한다.이정희 유한양행 사장은 ""이번 협약은 국내 최초로 대학-제약회사-바이오벤처의 세 기관이 화학적 결합을 통해 차별화된 뇌질환 R&BD; 생태계를 조성하는 것""이라며 ""이를 통해 혁신 신약개발을 위한 신성장동력을 확보하여 글로벌 제약사로의 도약과 국가 바이오산업의 미래지향적인 발전을 위해 매진할 것""이라고 말했다.앞서 성균관대와 유한양행은 지난해 6월 뇌질환 공동연구개발, 핵심인재 양성, 유망 벤처기업 발굴 및 육성 등을 포함한 포괄적·전략적 산학협력관계를 구축하는 업무협약을 체결한 바 있다. 사업내용의 일환으로 올해부터 차세대 핵심인재 양성을 위해 'YUHAN 신약개발 트랙' 프로그램을 시작했으며, 현재 유한양행과 아임뉴런은 3개의 뇌암·뇌질환 신약 프로그램을 공동 연구개발 하고 있다.김수연기자 newsnews@dt.co.kr이정희 유한양행 사장(가운데)와 신동렬 성균관대학교 총장(왼쪽 첫번째), 김한주 아임뉴런바이오사이언스 대표가 20일 산학융합 뇌질환 R&BD; 생태계 구축을 위한 협약을 체결하고 기념촬영을 하고 있다. 유한양행 제공     디지털타임스 채널 구독 / 뉴스스탠드 구독디지털타임스 홈페이지 바로가기"
10,유한양행,2020.05.20,edaily,"성대·유한양행·아임뉴런, 뇌질환 신약개발 추진","국내 최초 대학·제약사·바이오벤처 공동연구이정희 유한양행 사장, 신동렬 성균관대 총장, 김한주 아임뉴런바이오사이언스 대표(사진 왼쪽부터)가 20일 ‘산학융합 뇌질환 연구개발·사업화(R&BD;) 생태계 구축 협력사업 협약식’에 참석했다. 성균관대 제공[세종=이데일리 최훈길 기자] 성균관대, 유한양행, 아임뉴런바이오사이언스가 뇌질환 공동연구 및 사업화에 나선다. 성대, 유한양행, 아임뉴런바이오사이언스는 20일 산학융합 뇌질환 연구개발 및 사업화(R&BD;) 생태계 구축 협력사업 관련 3자 업무협약을 체결했다. 이는 국내 최초로 대학·제약회사·바이오벤처가 뇌질환 관련 공동협력에 나서는 것이다. 업무협약에는 △바이오 분야 교육·연구 클러스터 구축 △미래 유망 기술개발 및 중추신경계(CNS) 파이프라인 창출 △의약·바이오 공동연구 및 신약개발 협력 △뇌질환 산학융합연구소 설립 등 세계적인 수준의 지속 가능한 산학융합 뇌질환 R&BD; 생태계 구축 내용이 담겼다. 성대는 뇌질환 산학융합연구소 내 신규 학과를 신설하고 관련 산학연계 학위를 추진할 계획이다. 유한양행은 뇌질환 분야 유망한 기술을 육성하고 투자·공동개발에 나선다. 아임뉴런은 뇌질환 및 유전자질환 신약 개발을 본격 추진할 방침이다. 이들 기관들은 이번 협약이 혁신적인 신약 개발을 위한 시금석이 될 것으로 기대했다. 신동렬 성대 총장은 “바이오산업 발전, 인류 건강 증진의 공동 목표로 뜻깊은 산학협력 플랫폼이 출범했다”며 “앞으로 지속 가능한 R&BD; 생태계를 구축해 실효성 있는 연구 성과가 나오길 기대한다”고 말했다. 이정희 유한양행 사장은 “혁신 신약개발을 위한 신성장 동력을 확보하겠다”며 “글로벌 제약사로의 도약과 국가 바이오산업의 미래지향적인 발전을 위해 매진하겠다”고 다짐했다. 김한주 아임뉴런 대표는 “세 기관이 긴밀한 화합을 이뤄 시너지를 극대화할 것”이라며 “다복합 플랫폼기술 개발을 강화해 산학융합 글로벌 연구소기업으로 성장하겠다”고 강조했다.최훈길 (choigiga@edaily.co.kr)네이버에서 ‘이데일리’ 구독하기▶청춘뉘우스~ 스냅타임▶＜ⓒ종합 경제정보 미디어 이데일리 - 무단전재 & 재배포 금지＞"
11,라돈,2020.05.17,조선일보,"지하수 함유 라돈, 공기공급 장치로 85% 저감효과","충북보건연구원, 지하수 함유 라돈 공기 공급으로 저감 효과청주 충주 음성 보은 옥천 등 방사성 검출 가능성 높아연구원, 이들 지역 지하수 개발시 방사성 물질 검사 해야				지하수에 함유된 라돈은 급수 과정에서 공기를 공급하면 상당량 없앨 수 있다는 연구 결과가 나왔다.17일 충북도 보건환경연구원에 따르면 지하수 원수와 가정에서 사용하는 수도꼭지의 라돈 농도를 비교한 결과, 원수보다 수도꼭지가 평균 44% 정도 낮게 나타났다. 보건환경연구원은 “휘발성이 있는 라돈이 저수조에 체류하는 동안 공기 중으로 흩어지고 반감기(방사성 원소나 소립자가 붕괴 또는 다른 원소로 변할 경우, 그 원소의 원자 수가 최초의 반으로 줄 때까지 걸리는 시간)가 3.8일로 짧아 자연적으로 감소하기 때문”이라고 말했다.충북도 보건환경연구원 먹는 물 분석하는 모습/충북도				보건환경연구원은 원수의 라돈이 기준을 초과할 경우 물을 끓여 먹거나, 받아두었다가 마시는 것이 필요하다고 밝혔다. 특히 물속에 공기를 주입하는 형태의 라돈 저감시설을 설치한 경우 제거 효율은 85%로 높아졌다. 연구원 측은 “그러나 우라늄은 자연적 감소가 이뤄지지 않아 저감시설 설치가 꼭 필요한 것으로 나타났다”고 말했다.설치된 저감시설 제거효율을 분석한 결과, 98% 이상 제거돼 정수시설을 설치하면 안전하게 관리할 수 있었다. 연구원 측은 “지하수내 자연방사성 물질은 지질에 의한 영향을 많이 받는다”며 “라돈은 화강암 지역에서, 우라늄은 화강암 또는 화강암과 편마암 경계부에서 많이 발생하는 것으로 조사됐다”고 말했다.자연 방사성 물질이 높게 검출될 수 있는 지역은 청주, 충주, 음성, 진천, 괴산, 보은, 옥천 등이었다. 연구원은 이들 지역에서 지하수를 개발할 때 자연 방사성 물질 검사를 받아 안전성을 확인할 필요가 있다고 권고했다.이번 연구는 충북 도내 마을 상수도 362개 중 98곳을 표본 조사해 진행됐다.조사 결과, 자연 방사성 물질이 높게 검출되는 시설은 광역상수도 보급, 대체수원개발 또는 저감시설 설치 등이 필요한 것으로 드러났다. 보건환경연구원 관계자는 “충북지역 지하수 자연 방사성 물질 분포실태를 계속해서 조사할 계획”이라며 “안전한 지하수 개발과 이용을 위한 기초자료를 제공할 방침”이라고 말했다.[신정훈 기자 news1724@chosun.com] 		▶ 바뀐 우리집 공시가 확인하기 		▶ 네이버에서 조선일보 받아보기		▶ 조선일보 구독 신청하기 	- Copyrights ⓒ 조선일보 & chosun.com, 무단 전재 및 재배포 금지 -"
12,라돈,2020.05.17,뉴시스,"충북보건환경연구원, 지하수 라돈 급수과정서 평균 44% 자연 감소","【청주=뉴시스】충북도 보건환경연구원 전경. (사진=연구원 제공) photo@newsis.com[청주=뉴시스] 천영준 기자 = 지하수에 함유된 라돈은 급수 과정에서 공기를 공급하면 제거가 가능하다는 연구 결과가 나왔다.17일 충복도 보건환경연구원에 따르면 조사연구 사업을 통해 도내 마을 상수도의 라돈과 우라늄 함유 실태를 조사하고 저감 방안을 연구했다.우선 지하수 원수와 가정에서 사용하는 수도꼭지의 라돈 농도를 비교한 결과, 원수보다 수도꼭지가 평균 44% 정도 낮게 나타났다.라돈에 휘발성이 있어 저수조에 체류하는 동안 공기 중으로 휘발하고, 반감기가 3.8일로 짧아 자연적으로 감소했기 때문이다.특히 공기를 공급하는 방식의 라돈 저감시설을 설치하면 제거 효율은 85%로 높아진다. 간단한 저감시설 설치로 안전하게 라돈을 줄일 수 있다고 연구원은 설명했다.반면 우라늄의 경우 자연적인 감소가 이뤄지지 않아 저감시설 설치가 꼭 필요한 것으로 조사됐다.설치한 저감시설의 제거 효율을 분석한 결과 98% 이상 제거돼 정수시설을 설치하면 안전하게 관리할 수 있다.지하수 내 자연 방사성물질은 지질에 의한 영향을 많이 받는 것으로 나타났다. 라돈은 화강암 지역에서, 우라늄은 화강암이나 화강암·편마암의 경계부에 많았다.자연 방사성물질이 높게 검출될 수 있는 지역은 청주, 충주, 음성, 진천, 괴산, 보은, 옥천 등으로 조사됐다.이들 지역에서 지하수를 개발할 때는 자연 방사성물질 검사를 받아 안전성을 확인해야 한다.이번 연구는 충북 도내 마을 상수도 362곳 중 98곳을 표본 조사했다. 자연 방사성물질이 높게 검출되는 시설은 광역상수도 보급, 대체수원개발이나 저감시설 설치 등을 안내했다.도 보건환경연구원 관계자는 ""올해도 충북 지역 지하수의 자연 방사성물질 분포 실태를 조사할 계획""이라며 ""안전한 지하수 개발과 이용을 위한 기초자료를 제공할 방침""이라고 말했다.☞공감언론 뉴시스 yjc@newsis.com▶ 네이버에서 뉴시스 구독하기▶ K-Artprice, 유명 미술작품 가격 공개▶ 뉴시스 빅데이터 MSI 주가시세표 바로가기<ⓒ 공감언론 뉴시스통신사. 무단전재-재배포 금지>"
13,라돈,2020.05.17,뉴스1,"지하수 함유 라돈, 급수과정서 평균 44% 자연감소","간단히 공기공급만 해도 제거 가능청주·충주·음성·진천·괴산·보은·옥천 방사성물질 높게 검출지하수 사용 마을상수도 자연 방사성물질 검사./뉴스1(청주=뉴스1) 이성기 기자 = 지하수를 활용하는 마을 상수도에 함유된 라돈은 급수과정에서 간단히 공기공급만 해도 제거할 수 있는 것으로 나타났다.충북도 보건환경연구원이 2019년 조사연구사업을 통해 도내 마을 상수도의 라돈과 우라늄 함유 실태를 조사하고, 저감방안을 연구한 결과다.17일 보건환경연구원에 따르면 지하수 원수와 가정에서 사용하는 수도꼭지의 라돈 농도를 비교한 결과 원수보다 수도꼭지가 평균 44%정도 낮게 나타났다. 라돈에 휘발성이 있어 저수조에 체류하는 동안 공기 중으로 휘발하고, 반감기가 3.8일로 짧아 자연적으로 감소하는 덕분이다.보건환경연구원은 원수의 라돈이 기준을 초과하면 물을 끓여 먹거나 받아두었다가 음용하는 것이 필요하다고 밝혔다. 특히 공기공급 방식의 라돈 저감시설을 설치하면 제거효율은 85%로 높아져 간단한 저감시설 설치로도 안전하게 라돈을 저감할 수 있다. 우라늄은 자연적인 감소가 이뤄지지 않아 저감시설 설치가 꼭 필요하다.설치한 저감시설의 제거효율을 분석한 결과 98% 이상 제거돼 정수시설을 설치하면 안전하게 관리할 수 있다. 지하수 내 자연 방사성물질은 지질에 의한 영향을 많이 받는 것으로 나타났다. 라돈은 화강암 지역에서, 우라늄은 화강암 또는 화강암과 편마암의 경계부에서 높게 나타났다. 자연 방사성물질이 높게 검출될 수 있는 지역은 청주, 충주, 음성, 진천, 괴산, 보은, 옥천 등으로 조사됐다. 이들 지역에서는 지하수를 개발할 때 자연 방사성물질 검사를 받아 안전성을 확인할 필요가 있다고 보건환경연구원은 권고했다.이번 연구는 충북 도내 마을 상수도 362개 중 98곳을 표본조사했으며, 조사결과 자연 방사성물질이 높게 검출되는 시설은 광역상수도 보급, 대체수원개발 또는 저감시설 설치 등을 안내했다. 보건환경연구원은 올해도 충북지역 지하수의 자연 방사성물질 분포실태를 계속해서 조사할 계획이며, 안전한 지하수 개발과 이용을 위한 기초자료를 제공할 방침이다.sklee@news1.kr▶ 네이버 메인에서 [뉴스1] 구독하기!▶  뉴스1 바로가기 ▶  코로나19 뉴스 © 뉴스1코리아(news1.kr), 무단 전재 및 재배포 금지"
14,라돈,2020.04.29,동아사이언스,라돈침대·항공승무원 피폭 현안 해결하는 범부처 실무협의회 만든다,"방사선 안전 현안 해결 목적'라돈 매트리스' 사태 당시 당진항 야적장에 매트리스가 쌓여 있다. 연합뉴스    원자력안전위원회가 방사선 안전 현안을 논의하고 해법을 모색하기 위해 범부처가 참여하는 ‘방사선안전 실무협의회’를 구성·운영한다고 29일 밝혔다.    방사선안전 실무협의회는 2014년 출범한 원자력안전정책협의회 산하에 구성된다. 원안위 방사선방재국장 주재로 보건복지부, 환경부, 국토교통부, 식품의약품안전처 등 방사선 관련 업무를 담당하는 과장급 공무원이 참여한다. 전문적이고 시의성 있는 이슈 발굴과 검토를 위해 관련 분야 전문가들로 구성된 자문단도 함께 운영한다.    라돈 침대 사건 이후 생활용품 중 방사성물질이 검출되는 사례가 많아지고 있다. 항공승무원 방사선 피폭 등 다양한 분야에서 사회적 관심이 확대되는 추세다.    하지만 방사선 관련 업무가 부처별로 산재돼 부처간 협업을 통해 국민들의 혼란을 최소화하기 위한 대응방안 모색 필요성이 높아졌다.    원안위는 방사선안전 실무협의회를 통해 방사선 안전 분야 부처간 사각지대를 최소화하고 범부처 협업·조정체계 구축을 강화한다는 계획이다.    원안위는 또 협의회를 통해 개별적으로 관리하고 있는 방사선안전 기술기준, 측정·관리 절차의 정합성을 높이기 위한 기술적 지원을 전 부처에 제공한다. 방사선 안전규제 효율화도 추진할 계획이다. [김민수 기자 reborn@donga.com]▶ 과학동아·어린이과학동아·수학동아 모든 콘텐츠 무료보기▶ 네이버에서 동아사이언스 구독하기▶ 동아사이언스에 가서 뉴스 더보기ⓒ 동아사이언스 콘텐츠 무단 전재 및 재배포 금지"
15,라돈,2020.04.29,연합뉴스,"""라돈침대·방사선피폭 논의""…원안위, 다부처 실무협의회 구성","(서울=연합뉴스) 신선미 기자 = '라돈침대' 사태, 항공승무원 방사선 피폭 문제 등 방사선 안전 관리 현안을 다루는 다부처 실무협의회가 29일 출범했다.원자력안전위원회[원자력안전위원회 페이스북 캡처]    원자력안전위원회는 여러 부처가 참여하는 '방사선안전 실무협의회'를 구성, 운영한다고 이날 밝혔다.    실무협의회는 2014년 마련된 원자력안전정책협의회 산하 기구로 운영된다. 협의회 회의는 원자력안전위 방사선방재국장이 주재하고 보건복지부, 환경부, 국토교통부, 식품의약품안전처 등 방사선 관련 업무를 담당하는 부처의 과장급 공무원이 참여한다.    원자력안전위는 방사선 안전 관리 이슈를 발굴하기 위해, 관련 분야 전문가로 구성된 자문단도 구성할 예정이다.    원자력안전위는 ""'라돈침대' 사건 이후 방사선 안전과 관련한 사회적 관심이 확대되고 있지만, 방사선 관련 업무가 부처별로 산재 돼 있다""면서 ""이에 부처 간 협업을 통해 국민 혼란을 최소화하기 위한 대응 방안을 모색할 필요가 있다""고 협의회 구성 배경을 설명했다.    이어 ""실무협의회에서는 방사선 안전 분야에서 범부처 협업·조정 체계 구축을 강화해 나갈 계획""이라고 밝혔다.방사성 물질 라돈 검출ㆍ라돈침대 (PG)[제작 최자윤] 일러스트    sun@yna.co.kr▶코로나19 속보는 네이버 연합뉴스에서 [구독 클릭]▶[팩트체크] 연합뉴스가 확인한 '팩트' 이렇습니다▶제보하기"
